{
  "schemaVersion": "0.1.0",
  "status": "PROPOSED_NOT_ADOPTED",
  "title": "UNILEX — Universal Lexicon of Empire of the Light",
  "description": "71 source-aware seed concepts spanning universal values, scripture-specific referents, textual witnesses, and human-operated project vocabulary. English (en) is canonical; Indonesian (id) is the initial localization. All entries remain in draft pending source and bilingual editorial review.",
  "relationTypes": [
    "relatedTo",
    "inspiredBy",
    "distinctFrom",
    "exactMatch",
    "closeMatch",
    "narrowerThan",
    "broaderThan"
  ],
  "canonicalRules": [
    "Stable IDs are not reused",
    "Scriptural referents and textual witnesses are distinct",
    "No automatic exactMatch across religious traditions",
    "Persona/Scripture names never grant permissions or supernatural authority",
    "Source/edition licensing required before scripture ingest",
    "Human review required for source-specific mappings"
  ],
  "entries": [
    {
      "id": "U001",
      "preferredLabel": {
        "en": "Truth",
        "id": "Kebenaran"
      },
      "domain": "UNIVERSAL",
      "kind": "concept",
      "definition": {
        "id": "Pernyataan atau keadaan yang sesuai fakta; klaim memerlukan konteks dan dasar penilaian.",
        "en": "A statement or condition that corresponds to facts; claims require context and a stated basis for evaluation."
      },
      "alternateLabels": {},
      "sourceReferences": [],
      "relations": [],
      "status": "DRAFT_REVIEW"
    },
    {
      "id": "U002",
      "preferredLabel": {
        "en": "Evidence",
        "id": "Bukti"
      },
      "domain": "UNIVERSAL",
      "kind": "concept",
      "definition": {
        "id": "Materi, pengamatan, atau dokumen yang mendukung atau membantah suatu klaim.",
        "en": "Material, observations, or documents that support or challenge a claim."
      },
      "alternateLabels": {},
      "sourceReferences": [],
      "relations": [],
      "status": "DRAFT_REVIEW"
    },
    {
      "id": "U003",
      "preferredLabel": {
        "en": "Trust",
        "id": "Kepercayaan"
      },
      "domain": "UNIVERSAL",
      "kind": "concept",
      "definition": {
        "id": "Kesediaan mengandalkan pihak atau sistem berdasarkan integritas dan ekspektasi yang dapat diperiksa.",
        "en": "Willingness to rely on a person or system based on integrity and reviewable expectations."
      },
      "alternateLabels": {},
      "sourceReferences": [],
      "relations": [],
      "status": "DRAFT_REVIEW"
    },
    {
      "id": "U004",
      "preferredLabel": {
        "en": "Responsibility",
        "id": "Tanggung Jawab"
      },
      "domain": "UNIVERSAL",
      "kind": "concept",
      "definition": {
        "id": "Kewajiban terdefinisi untuk melaksanakan tugas dan menjelaskan akibat tindakannya.",
        "en": "A defined duty to perform a task and explain the consequences of one’s actions."
      },
      "alternateLabels": {},
      "sourceReferences": [],
      "relations": [],
      "status": "DRAFT_REVIEW"
    },
    {
      "id": "U005",
      "preferredLabel": {
        "en": "Accountability",
        "id": "Akuntabilitas"
      },
      "domain": "UNIVERSAL",
      "kind": "concept",
      "definition": {
        "id": "Kapasitas menjelaskan, diaudit, dan dikoreksi atas keputusan atau tindakan.",
        "en": "The capacity to explain, audit, and correct decisions or actions."
      },
      "alternateLabels": {},
      "sourceReferences": [],
      "relations": [],
      "status": "DRAFT_REVIEW"
    },
    {
      "id": "U006",
      "preferredLabel": {
        "en": "Human Agency",
        "id": "Otonomi Manusia"
      },
      "domain": "UNIVERSAL",
      "kind": "concept",
      "definition": {
        "id": "Kemampuan dan hak manusia memilih tindakan berdasarkan informasi dan izin yang sah.",
        "en": "A person’s ability and right to choose actions based on information and valid authorization."
      },
      "alternateLabels": {},
      "sourceReferences": [],
      "relations": [],
      "status": "DRAFT_REVIEW"
    },
    {
      "id": "U007",
      "preferredLabel": {
        "en": "Consent",
        "id": "Persetujuan"
      },
      "domain": "UNIVERSAL",
      "kind": "concept",
      "definition": {
        "id": "Izin spesifik, diinformasikan, dan dapat dicabut sesuai konteks yang berlaku.",
        "en": "Specific, informed, and revocable permission within the applicable context."
      },
      "alternateLabels": {},
      "sourceReferences": [],
      "relations": [],
      "status": "DRAFT_REVIEW"
    },
    {
      "id": "U008",
      "preferredLabel": {
        "en": "Dignity",
        "id": "Martabat"
      },
      "domain": "UNIVERSAL",
      "kind": "concept",
      "definition": {
        "id": "Nilai dan penghormatan yang melekat pada manusia dalam sistem sosial dan operasional.",
        "en": "The inherent worth of people and the respect owed to them in social and operational systems."
      },
      "alternateLabels": {},
      "sourceReferences": [],
      "relations": [],
      "status": "DRAFT_REVIEW"
    },
    {
      "id": "U009",
      "preferredLabel": {
        "en": "Justice",
        "id": "Keadilan"
      },
      "domain": "UNIVERSAL",
      "kind": "concept",
      "definition": {
        "id": "Penanganan hak, kewajiban, dan sengketa dengan standar yang adil dan dapat diperiksa.",
        "en": "The handling of rights, duties, and disputes under fair and reviewable standards."
      },
      "alternateLabels": {},
      "sourceReferences": [],
      "relations": [],
      "status": "DRAFT_REVIEW"
    },
    {
      "id": "U010",
      "preferredLabel": {
        "en": "Fairness",
        "id": "Kewajaran"
      },
      "domain": "UNIVERSAL",
      "kind": "concept",
      "definition": {
        "id": "Tidak adanya perlakuan sewenang-wenang dan adanya penilaian yang beralasan serta dapat diuji.",
        "en": "The absence of arbitrary treatment and the use of reasoned, testable assessment."
      },
      "alternateLabels": {},
      "sourceReferences": [],
      "relations": [],
      "status": "DRAFT_REVIEW"
    },
    {
      "id": "U011",
      "preferredLabel": {
        "en": "Compassion",
        "id": "Welaskasih"
      },
      "domain": "UNIVERSAL",
      "kind": "concept",
      "definition": {
        "id": "Kepekaan terhadap kesulitan orang lain disertai kemauan membantu secara tepat.",
        "en": "Sensitivity to another person’s difficulties together with a willingness to provide appropriate help."
      },
      "alternateLabels": {},
      "sourceReferences": [],
      "relations": [],
      "status": "DRAFT_REVIEW"
    },
    {
      "id": "U012",
      "preferredLabel": {
        "en": "Consultation",
        "id": "Musyawarah"
      },
      "domain": "UNIVERSAL",
      "kind": "concept",
      "definition": {
        "id": "Proses meminta dan mempertimbangkan masukan pemangku kepentingan.",
        "en": "A process for seeking and considering input from stakeholders."
      },
      "alternateLabels": {},
      "sourceReferences": [],
      "relations": [],
      "status": "DRAFT_REVIEW"
    },
    {
      "id": "U013",
      "preferredLabel": {
        "en": "Covenant",
        "id": "Perjanjian Komitmen"
      },
      "domain": "UNIVERSAL",
      "kind": "concept",
      "definition": {
        "id": "Kesepakatan komitmen antara pihak yang secara sadar menyetujuinya.",
        "en": "An agreement of commitment between parties who consent to it knowingly."
      },
      "alternateLabels": {},
      "sourceReferences": [],
      "relations": [],
      "status": "DRAFT_REVIEW"
    },
    {
      "id": "U014",
      "preferredLabel": {
        "en": "Stewardship",
        "id": "Pengelolaan Bertanggung Jawab"
      },
      "domain": "UNIVERSAL",
      "kind": "concept",
      "definition": {
        "id": "Pengelolaan sesuatu yang dipercayakan dengan memperhatikan manfaat dan keberlanjutan.",
        "en": "Responsible management of something entrusted, with attention to benefit and sustainability."
      },
      "alternateLabels": {},
      "sourceReferences": [],
      "relations": [],
      "status": "DRAFT_REVIEW"
    },
    {
      "id": "U015",
      "preferredLabel": {
        "en": "Protection",
        "id": "Perlindungan"
      },
      "domain": "UNIVERSAL",
      "kind": "concept",
      "definition": {
        "id": "Pencegahan dan penanganan kerugian melalui pengamanan yang sah dan proporsional.",
        "en": "The prevention and handling of harm through lawful and proportionate safeguards."
      },
      "alternateLabels": {},
      "sourceReferences": [],
      "relations": [],
      "status": "DRAFT_REVIEW"
    },
    {
      "id": "U016",
      "preferredLabel": {
        "en": "Restoration",
        "id": "Pemulihan"
      },
      "domain": "UNIVERSAL",
      "kind": "concept",
      "definition": {
        "id": "Proses memperbaiki kerugian, fungsi, atau hubungan yang terganggu.",
        "en": "A process for repairing harm, function, or a disrupted relationship."
      },
      "alternateLabels": {},
      "sourceReferences": [],
      "relations": [],
      "status": "DRAFT_REVIEW"
    },
    {
      "id": "U017",
      "preferredLabel": {
        "en": "Continuity",
        "id": "Keberlanjutan"
      },
      "domain": "UNIVERSAL",
      "kind": "concept",
      "definition": {
        "id": "Kemampuan proses, pengetahuan, dan tanggung jawab berlanjut saat kondisi berubah.",
        "en": "The ability of processes, knowledge, and responsibilities to continue as conditions change."
      },
      "alternateLabels": {},
      "sourceReferences": [],
      "relations": [],
      "status": "DRAFT_REVIEW"
    },
    {
      "id": "U018",
      "preferredLabel": {
        "en": "Knowledge",
        "id": "Pengetahuan"
      },
      "domain": "UNIVERSAL",